{
  "$schema": "https://json-schema.org/draft/2020-12/schema",
  "title": "Arbiter Academy Preview 0.33 publication manifest",
  "type": "object",
  "additionalProperties": false,
  "required": ["release", "lesson_contract_version", "available_labs", "runnable_labs", "guided_labs", "coming_next", "prerequisites", "known_limits", "discussion_url", "catalog_sha256", "integration_compatibility"],
  "properties": {
    "release": {"const": "preview-0.33"},
    "lesson_contract_version": {"type": "integer", "const": 1},
    "available_labs": {
      "type": "array",
      "minItems": 19,
      "maxItems": 19,
      "items": false,
      "prefixItems": [
        {"const": "F01-fork-clone-doctor"},
        {"const": "F02-orient-to-state"},
        {"const": "F03-work-the-board"},
        {"const": "F04-fix-with-evidence"},
        {"const": "P01-feature-through-plan"},
        {"const": "P02-commit-review-pr"},
        {"const": "P03-record-an-adr"},
        {"const": "P04-review-a-dependency"},
        {"const": "P05-checkpoint-remediation"},
        {"const": "P06-context-drift-recovery"},
        {"const": "P07-threat-model"},
        {"const": "P08-repository-hygiene"},
        {"const": "U01-autonomous-sprint"},
        {"const": "U02-override-audit-metrics"},
        {"const": "U03-refactor-chore-release"},
        {"const": "U04-initialize-projects"},
        {"const": "U05-debug-spike-conflict"},
        {"const": "U06-preview-and-advanced-surfaces"},
        {"const": "U07-capstone"}
      ]
    },
    "runnable_labs": {
      "type": "array",
      "minItems": 19,
      "maxItems": 19,
      "items": false,
      "prefixItems": [
        {"const": "F01-fork-clone-doctor"},
        {"const": "F02-orient-to-state"},
        {"const": "F03-work-the-board"},
        {"const": "F04-fix-with-evidence"},
        {"const": "P01-feature-through-plan"},
        {"const": "P02-commit-review-pr"},
        {"const": "P03-record-an-adr"},
        {"const": "P04-review-a-dependency"},
        {"const": "P05-checkpoint-remediation"},
        {"const": "P06-context-drift-recovery"},
        {"const": "P07-threat-model"},
        {"const": "P08-repository-hygiene"},
        {"const": "U01-autonomous-sprint"},
        {"const": "U02-override-audit-metrics"},
        {"const": "U03-refactor-chore-release"},
        {"const": "U04-initialize-projects"},
        {"const": "U05-debug-spike-conflict"},
        {"const": "U06-preview-and-advanced-surfaces"},
        {"const": "U07-capstone"}
      ]
    },
    "guided_labs": {
      "type": "array",
      "minItems": 19,
      "maxItems": 19,
      "items": false,
      "prefixItems": [
        {"const": "F01-fork-clone-doctor"},
        {"const": "F02-orient-to-state"},
        {"const": "F03-work-the-board"},
        {"const": "F04-fix-with-evidence"},
        {"const": "P01-feature-through-plan"},
        {"const": "P02-commit-review-pr"},
        {"const": "P03-record-an-adr"},
        {"const": "P04-review-a-dependency"},
        {"const": "P05-checkpoint-remediation"},
        {"const": "P06-context-drift-recovery"},
        {"const": "P07-threat-model"},
        {"const": "P08-repository-hygiene"},
        {"const": "U01-autonomous-sprint"},
        {"const": "U02-override-audit-metrics"},
        {"const": "U03-refactor-chore-release"},
        {"const": "U04-initialize-projects"},
        {"const": "U05-debug-spike-conflict"},
        {"const": "U06-preview-and-advanced-surfaces"},
        {"const": "U07-capstone"}
      ]
    },
    "coming_next": {
      "type": "array",
      "minItems": 0,
      "maxItems": 0,
      "items": false
    },
    "prerequisites": {
      "type": "array",
      "minItems": 5,
      "maxItems": 5,
      "items": false,
      "prefixItems": [
        {"const": "A GitHub account that can create a personal fork."},
        {"const": "Git 2.39 or newer."},
        {"const": "Python 3.11 or newer."},
        {"const": "A supported CodeArbiter host: Claude Code, Codex, or Pi."},
        {"const": "Complete Academy Home setup steps 1-5 before starting F01."}
      ]
    },
    "known_limits": {
      "type": "array",
      "minItems": 2,
      "maxItems": 2,
      "items": false,
      "prefixItems": [
        {"const": "F01-F04, P01-P08, and U01-U07 are the guided lessons published in Preview 0.33."},
        {"const": "Graduation is available after all 19 Academy Checks pass in the same repository."}
      ]
    },
    "discussion_url": {
      "type": "string",
      "pattern": "^https://github\\.com/arbiterForge/arbiter-academy/discussions(?:/[A-Za-z0-9_~-][A-Za-z0-9._~-]*)*/?$"
    },
    "catalog_sha256": {"type": "string", "pattern": "^[0-9a-f]{64}$"},
    "integration_compatibility": {
      "type": "object",
      "additionalProperties": false,
      "required": ["academy_release", "evidence_level", "components"],
      "properties": {
        "academy_release": {"type": "string", "const": "preview-0.33"},
        "evidence_level": {"type": "string", "const": "release-and-command-contract"},
        "components": {
          "type": "array",
          "minItems": 3,
          "maxItems": 3,
          "items": false,
          "prefixItems": [
            {
              "type": "object",
              "additionalProperties": false,
              "required": ["component_id", "display_name", "release_tag", "version", "source_commit", "manifest_path", "manifest_sha256"],
              "properties": {
                "component_id": {"type": "string", "const": "codearbiter"},
                "display_name": {"type": "string", "const": "codeArbiter"},
                "release_tag": {"type": "string", "const": "v3.2.6"},
                "version": {"type": "string", "const": "3.2.6"},
                "source_commit": {"type": "string", "const": "849a3cf6fa6f4fdf3256cd3095c92499e9c4ec77"},
                "manifest_path": {"type": "string", "const": "plugins/ca/.claude-plugin/plugin.json"},
                "manifest_sha256": {"type": "string", "const": "d1370de9a243f07d26701ed79036ec7d743228bf0e3b461870df55ddf288ab64"}
              }
            },
            {
              "type": "object",
              "additionalProperties": false,
              "required": ["component_id", "display_name", "release_tag", "version", "source_commit", "manifest_path", "manifest_sha256"],
              "properties": {
                "component_id": {"type": "string", "const": "ca-codex"},
                "display_name": {"type": "string", "const": "Codex"},
                "release_tag": {"type": "string", "const": "ca-codex-v0.20.6"},
                "version": {"type": "string", "const": "0.20.6"},
                "source_commit": {"type": "string", "const": "849a3cf6fa6f4fdf3256cd3095c92499e9c4ec77"},
                "manifest_path": {"type": "string", "const": "plugins/ca-codex/.codex-plugin/plugin.json"},
                "manifest_sha256": {"type": "string", "const": "777063dc90267d109d4b1c15d544773b78a5d29b9a6be9d14fd4603791ac15f7"}
              }
            },
            {
              "type": "object",
              "additionalProperties": false,
              "required": ["component_id", "display_name", "release_tag", "version", "source_commit", "manifest_path", "manifest_sha256"],
              "properties": {
                "component_id": {"type": "string", "const": "ca-pi"},
                "display_name": {"type": "string", "const": "Pi"},
                "release_tag": {"type": "string", "const": "ca-pi-v0.21.6"},
                "version": {"type": "string", "const": "0.21.6"},
                "source_commit": {"type": "string", "const": "849a3cf6fa6f4fdf3256cd3095c92499e9c4ec77"},
                "manifest_path": {"type": "string", "const": "plugins/ca-pi/package.json"},
                "manifest_sha256": {"type": "string", "const": "f9c6ddffc4b9fbeb74e443e013811b4e88a7c5b8aba25fd8e1c0fe2d9e2fd499"}
              }
            }
          ]
        }
      }
    }
  }
}
